{"schema_version":"rg_semantic_verifier_output.v1","batch_id":"pr-208-batch-001","proposal_sha256":"46fd0a8a0bc5bb9c38b66ecb191e8191677d11b5d9a7eee48c1e5f1d995cccd9","decisions":[{"candidate_id":"C:G1:E:structural_change:44a2370ce77a6e66f8e7","decision":"accept","reviewer_semantic_relation":"contextual_support","reviewer_proofability":"not_applicable","reviewer_proof_basis":"none","evidence_witnesses":[],"note":"Supported by bounded source evidence."},{"candidate_id":"C:G1:E:structural_change:4fbcf96b02d19017c2c9","decision":"accept","reviewer_semantic_relation":"contextual_support","reviewer_proofability":"not_applicable","reviewer_proof_basis":"none","evidence_witnesses":[],"note":"Supported by bounded source evidence."},{"candidate_id":"C:G1:E:structural_change:5d2be31cc60dea3d2f3b","decision":"accept","reviewer_semantic_relation":"contextual_support","reviewer_proofability":"not_applicable","reviewer_proof_basis":"none","evidence_witnesses":[],"note":"Supported by bounded source evidence."},{"candidate_id":"C:G1:E:structural_change:7c4162e02e623fea377f","decision":"accept","reviewer_semantic_relation":"contextual_support","reviewer_proofability":"not_applicable","reviewer_proof_basis":"none","evidence_witnesses":[],"note":"Supported by bounded source evidence."},{"candidate_id":"C:G1:E:structural_change:9ff44326982c1acafe85","decision":"challenge","reviewer_semantic_relation":"unrelated","reviewer_proofability":"not_applicable","reviewer_proof_basis":"none","evidence_witnesses":[],"note":"The changed seed code does not itself enforce this guardrail."},{"candidate_id":"C:G1:E:structural_change:d0cf036a1010c1207bc5","decision":"challenge","reviewer_semantic_relation":"unrelated","reviewer_proofability":"not_applicable","reviewer_proof_basis":"none","evidence_witnesses":[],"note":"The changed seed code does not itself enforce this guardrail."},{"candidate_id":"C:G2:E:structural_change:44a2370ce77a6e66f8e7","decision":"accept","reviewer_semantic_relation":"contextual_support","reviewer_proofability":"not_applicable","reviewer_proof_basis":"none","evidence_witnesses":[],"note":"Supported by bounded source evidence."},{"candidate_id":"C:G2:E:structural_change:4fbcf96b02d19017c2c9","decision":"accept","reviewer_semantic_relation":"contextual_support","reviewer_proofability":"not_applicable","reviewer_proof_basis":"none","evidence_witnesses":[],"note":"Supported by bounded source evidence."},{"candidate_id":"C:G2:E:structural_change:5d2be31cc60dea3d2f3b","decision":"challenge","reviewer_semantic_relation":"directly_verifies","reviewer_proofability":"direct_capable","reviewer_proof_basis":"bounded_evidence","evidence_witnesses":["https://github.com/repodelta/repodelta/blob/e6d94bd9c414a09c1027aac0bc658ba025ddf3ad/tests/test_projection.py#L1473-L1514"],"note":"The changed test directly asserts exclusion behavior."},{"candidate_id":"C:G2:E:structural_change:7c4162e02e623fea377f","decision":"challenge","reviewer_semantic_relation":"directly_verifies","reviewer_proofability":"direct_capable","reviewer_proof_basis":"bounded_evidence","evidence_witnesses":["https://github.com/repodelta/repodelta/blob/e6d94bd9c414a09c1027aac0bc658ba025ddf3ad/tests/test_projection.py#L766-L1171"],"note":"The changed test directly asserts exclusion behavior."},{"candidate_id":"C:G2:E:structural_change:9ff44326982c1acafe85","decision":"challenge","reviewer_semantic_relation":"contextual_support","reviewer_proofability":"not_applicable","reviewer_proof_basis":"none","evidence_witnesses":[],"note":"Removing the caller argument supports, but does not itself enforce, exclusion."},{"candidate_id":"C:G2:E:structural_change:d0cf036a1010c1207bc5","decision":"accept","reviewer_semantic_relation":"constrains","reviewer_proofability":"direct_capable","reviewer_proof_basis":"deterministic_mapping","evidence_witnesses":["https://github.com/repodelta/repodelta/blob/e6d94bd9c414a09c1027aac0bc658ba025ddf3ad/src/prismcode/projection/build.py#L435-L457"],"note":"Supported by bounded source evidence."},{"candidate_id":"C:G3:E:structural_change:44a2370ce77a6e66f8e7","decision":"accept","reviewer_semantic_relation":"contextual_support","reviewer_proofability":"not_applicable","reviewer_proof_basis":"none","evidence_witnesses":[],"note":"Supported by bounded source evidence."},{"candidate_id":"C:G3:E:structural_change:4fbcf96b02d19017c2c9","decision":"accept","reviewer_semantic_relation":"contextual_support","reviewer_proofability":"not_applicable","reviewer_proof_basis":"none","evidence_witnesses":[],"note":"Supported by bounded source evidence."},{"candidate_id":"C:G3:E:structural_change:5d2be31cc60dea3d2f3b","decision":"accept","reviewer_semantic_relation":"contextual_support","reviewer_proofability":"not_applicable","reviewer_proof_basis":"none","evidence_witnesses":[],"note":"Supported by bounded source evidence."},{"candidate_id":"C:G3:E:structural_change:7c4162e02e623fea377f","decision":"accept","reviewer_semantic_relation":"contextual_support","reviewer_proofability":"not_applicable","reviewer_proof_basis":"none","evidence_witnesses":[],"note":"Supported by bounded source evidence."},{"candidate_id":"C:G3:E:structural_change:9ff44326982c1acafe85","decision":"challenge","reviewer_semantic_relation":"unrelated","reviewer_proofability":"not_applicable","reviewer_proof_basis":"none","evidence_witnesses":[],"note":"The changed seed code does not itself enforce this guardrail."},{"candidate_id":"C:G3:E:structural_change:d0cf036a1010c1207bc5","decision":"challenge","reviewer_semantic_relation":"unrelated","reviewer_proofability":"not_applicable","reviewer_proof_basis":"none","evidence_witnesses":[],"note":"The changed seed code does not itself enforce this guardrail."},{"candidate_id":"C:G4:E:structural_change:44a2370ce77a6e66f8e7","decision":"accept","reviewer_semantic_relation":"contextual_support","reviewer_proofability":"not_applicable","reviewer_proof_basis":"none","evidence_witnesses":[],"note":"Supported by bounded source evidence."},{"candidate_id":"C:G4:E:structural_change:4fbcf96b02d19017c2c9","decision":"accept","reviewer_semantic_relation":"contextual_support","reviewer_proofability":"not_applicable","reviewer_proof_basis":"none","evidence_witnesses":[],"note":"Supported by bounded source evidence."},{"candidate_id":"C:G4:E:structural_change:5d2be31cc60dea3d2f3b","decision":"accept","reviewer_semantic_relation":"contextual_support","reviewer_proofability":"not_applicable","reviewer_proof_basis":"none","evidence_witnesses":[],"note":"Supported by bounded source evidence."},{"candidate_id":"C:G4:E:structural_change:7c4162e02e623fea377f","decision":"accept","reviewer_semantic_relation":"contextual_support","reviewer_proofability":"not_applicable","reviewer_proof_basis":"none","evidence_witnesses":[],"note":"Supported by bounded source evidence."},{"candidate_id":"C:G4:E:structural_change:9ff44326982c1acafe85","decision":"challenge","reviewer_semantic_relation":"unrelated","reviewer_proofability":"not_applicable","reviewer_proof_basis":"none","evidence_witnesses":[],"note":"The changed seed code does not itself enforce this guardrail."},{"candidate_id":"C:G4:E:structural_change:d0cf036a1010c1207bc5","decision":"challenge","reviewer_semantic_relation":"unrelated","reviewer_proofability":"not_applicable","reviewer_proof_basis":"none","evidence_witnesses":[],"note":"The changed seed code does not itself enforce this guardrail."},{"candidate_id":"C:R1:E:structural_change:44a2370ce77a6e66f8e7","decision":"accept","reviewer_semantic_relation":"contextual_support","reviewer_proofability":"not_applicable","reviewer_proof_basis":"none","evidence_witnesses":[],"note":"Supported by bounded source evidence."},{"candidate_id":"C:R1:E:structural_change:4fbcf96b02d19017c2c9","decision":"accept","reviewer_semantic_relation":"contextual_support","reviewer_proofability":"not_applicable","reviewer_proof_basis":"none","evidence_witnesses":[],"note":"Supported by bounded source evidence."},{"candidate_id":"C:R1:E:structural_change:5d2be31cc60dea3d2f3b","decision":"challenge","reviewer_semantic_relation":"directly_verifies","reviewer_proofability":"direct_capable","reviewer_proof_basis":"bounded_evidence","evidence_witnesses":["https://github.com/repodelta/repodelta/blob/e6d94bd9c414a09c1027aac0bc658ba025ddf3ad/tests/test_projection.py#L1473-L1514"],"note":"The changed test directly asserts membership behavior."},{"candidate_id":"C:R1:E:structural_change:7c4162e02e623fea377f","decision":"challenge","reviewer_semantic_relation":"directly_verifies","reviewer_proofability":"direct_capable","reviewer_proof_basis":"bounded_evidence","evidence_witnesses":["https://github.com/repodelta/repodelta/blob/e6d94bd9c414a09c1027aac0bc658ba025ddf3ad/tests/test_projection.py#L766-L1171"],"note":"The changed test directly asserts membership behavior."},{"candidate_id":"C:R1:E:structural_change:9ff44326982c1acafe85","decision":"challenge","reviewer_semantic_relation":"contextual_support","reviewer_proofability":"not_applicable","reviewer_proof_basis":"none","evidence_witnesses":[],"note":"Removing the caller argument supports the requirement; role-only seed logic realizes it."},{"candidate_id":"C:R1:E:structural_change:d0cf036a1010c1207bc5","decision":"accept","reviewer_semantic_relation":"implements","reviewer_proofability":"direct_capable","reviewer_proof_basis":"deterministic_mapping","evidence_witnesses":["https://github.com/repodelta/repodelta/blob/e6d94bd9c414a09c1027aac0bc658ba025ddf3ad/src/prismcode/projection/build.py#L435-L457"],"note":"Supported by bounded source evidence."},{"candidate_id":"C:R2:E:structural_change:44a2370ce77a6e66f8e7","decision":"accept","reviewer_semantic_relation":"contextual_support","reviewer_proofability":"not_applicable","reviewer_proof_basis":"none","evidence_witnesses":[],"note":"Supported by bounded source evidence."},{"candidate_id":"C:R2:E:structural_change:4fbcf96b02d19017c2c9","decision":"accept","reviewer_semantic_relation":"contextual_support","rev